content,time,title
"Memphis Grizzlies, an American professional basketball team, which competes in the NBA, has hired an Indian-American as its assistant coach.,Sonia Raman joins Vin Bhavnani (Oklahoma City Thunder) and Roy Rana (Sacramento Kings) as the only coaches of Indian origin in the National Basketball Association.,Raman becomes the 14th female assistant coach in the history of the NBA and the 10th among current coaching staffers in the league. She becomes the seventh female coach to be hired as an assistant in the league since the beginning of the 2019-20 season.,According to ESPN's Adrian Wojnarowski, she replaces Niele Ivey, another women's assistant coach who left for a head coaching position at the University of Notre Dame.,""She has a high basketball IQ and a tremendous ability to teach the game, as well as a strong passion for the game,"" head coach Taylor Jenkins said.,""She is going to be a great addition to our current coaching staff.""            ,Raman had served as the head coach of the women's basketball team at the Massachusetts Institute of Technology (MIT) since 2008. She guided the programme to their first championships with consecutive NEWMAC (New England Women's and Men's Athletic Conference) titles in 2018 and 2019. She is the ""winningest coach"" in the programme's history, according to her official bio on MIT's athletic website.,She began her coaching career at Tufts University, where she graduated with a Bachelor of Arts degree in International Relations in 1996. After a two-year stint with her alma mater, she spent six years as the top assistant coach at Wellesley College before joining MIT.,""I'm thrilled to have the opportunity to be part of the Memphis Grizzlies coaching staff. I can't wait to get to Memphis and get started with Taylor, his staff and the team's emerging young core,"" Raman said.,""I must also give a truly special thank you to MIT and the women I've had the honour of coaching for the past 12 years. I wish the programme continued success.""","Sep 16, 2020
                            ,09:27 AM (IST),10 days ago                            ",Indian-American appointed NBA basketball assistant coach for Memphis team
"Avneet Kaur,Jalandhar, September 16,It was a proud moment for the parents of Harminder Pal Singh (33), who was recruited in the British army.,“I am on cloud nine. Three years of my son’s hard work and focused preparation has finally yielded results,” an elated Salukhan Singh, Harminder’s father, told The Tribune, adding that he was filled with pride and honour, as his son was now a part of the Royal Regiment of Artillery, commonly known as ‘The Gunners’, which is the frontline fighting force of the British Army.,In a telephonic conversation with The Tribune, Harminder Pal Singh said there were about 150 Sikhs in the British army. There are 205 Sikhs in the British air force and navy combined. Also, one of his companions is Amritdhari (baptised) Sikh, and they have been allotted separate rooms to do the paath.,Born and brought up in Jalandhar, Harminder, a resident of Ramneek Avenue here, is an electronics and communication engineer, who passed out from Lord Krishna College, Kapurthala. His father said his son always wanted to join the Army, as he was fascinated by the lives of officers, but his dream only got a push when he visited England on a visitor visa in 2017 and met his brother-in-law, who, too, is serving as an officer in the British army, and who gave wings to the dreams of Harminder by motivating him to at least give it a try.,His father said Harminder after completing his studies moved to Australia in 2008 and after working there for nearly eight years, he came back to Jalandhar in 2016.,“My son came back because he wanted to do some reputed job. In the meantime, we fixed his marriage, too! Thereafter, when he visited England, his brother-in-law, Nishan Singh, asked him to join the British army. Inspired by his words, he immediately started his preparation as well as physical training. Eventually, in February 2020, he got selected and just a few months ago he joined the Royal Artillery,” he said.,“It’s really a proud moment for everyone in the family, as getting a reputed job in a foreign country is not easy. People are losing jobs already due to Covid and employment has become a serious issue. Thus, I am very much thankful to God for showing us this day. There is no bigger happiness for a father than to see his son live his dream,” said Salukhan, who performs kirtan here, adding that Harminder’s two younger brothers Maninderpal Singh and Jagwinderpal Singh, were also living in Australia at present. While one was still studying, the other one was working.,Meanwhile, Ranjit Kaur, wife of Harminder Singh, said her son, who is just 3-year-old, was very fond of wearing military uniform. She said he also wants to be a soldier like his father when he grows up.","Sep 17, 2020
                            ,07:53 AM (IST),9 days ago                            ",Proud parents on cloud nine  as son selected in British army
"A Sikh father-daughter duo made it to Apple’s introductory theme at a virtual event organised by the tech giant to make key announcements regarding the launch of its 8th gen iPads and other gadgets in near future.,Called ‘Time Flies’, the event, however, did not witness the launch of iPhone 2020, as was being anticipated by many. Among the other gadgets the company showcased were Apple Watch Series 6, Apple Watch SE and Apple Fitness Plus, an assisted fitness guidance package.,Kudos & thanks to , for Diversity in the ,Absolutely happy to see a Sikh father and daughter in Apple’s introduction of the 8th generation iPad.,Representation matters!,Black, Sikh, Hispanic, Latino & many more faces are so important for generations to come. ,“Kudos & thanks to @Apple for Diversity in the #AppleEvent Absolutely happy to see a Sikh father and daughter in Apple’s introduction of the 8th generation iPad. Representation matters! Black, Sikh, Hispanic, Latino & many more faces are so important for generations to come,” tweeted Kukreja as he highlighted the development.","Sep 16, 2020
                            ,12:19 PM (IST),10 days ago                            ",Apple shows diversity in launch event; Sikh man and daughter feature in introduction
"Singapore, September 24,An Indian-origin police official in Singapore has been sentenced to two years in jail after pleading guilty to four counts, including two for corruption in the form of seeking sexual favours from women under investigation.,Mahendran Selvarajoo, staff sergeant with the Singapore Police Force, pleaded guilty to the charges, including to the two other offences under the Computer Misuse Act for copying data - sexually explicit videos – on his own devices.,The Corrupt Practices Investigation Bureau arrested Mahendran, 32, on May 1 last year for seeking sexual favours from women, who he was investigating for shop-theft and credit card frauds.,As investigating officer, Mahendran contacted a woman linked to a case involving shop-theft and lied to her that her company had contacted the police about the investigation.,He told her that he would help her and sought sexual favours from her to which she complied, fearing she could lose her job.,Similarly, Mahendran exploited another woman for help in investigations and took explicit videos from her laptop under the guise of investigations, the TODAY newspaper reported.,Court documents stated that Mahendran's duties were to carry out commercial crime investigations that entailed interviewing witnesses, among other things.,Despite being told by his senior that one of the cases was no longer with him, Mahendran went to a woman's home to get her signatures on an amended police statement that had new paragraphs inserted to highlight factors in her favour.,Mahendran faced a jail term of up to five years or a fine of SGD 100,000 (USD 72,703) for each corruption charge. PTI  ","Sep 24, 2020
                            ,11:30 AM (IST),2 days ago                            ",Indian-origin police officer in Singapore jailed for seeking sexual favours from women
"Washington, September 17,The FBI has announced a reward of $15,000 to anyone giving information leading to those responsible for the abduction and murder of Indian national Pareshkumar Patel in the US in 2012.,Patel was abducted from Raceway Gas Station he operated in Chesterfield, Virginia, on September 16, 2012, and four days later his body with gunshots was found at the Ancarrow Boat Landing in the City of Richmond, Virginia.,This case is being investigated by the Federal Bureau of Investigation’s Richmond’s Central Virginia Violent Crimes Task Force, as part of a cold case initiative to assist the City of Richmond Police Department with unsolved homicide investigations.,According to the FBI, on September 16, a witness reported to the Chesterfield County Police Department observing Patel arrived at his store at approximately 6 am, exited his vehicle and was immediately approached by two individuals.,These two persons of interest, dressed in hoodies, shoved Patel into a van and sped off. Patel was located days later, deceased.,FBI Richmond is offering a reward of up to $15,000 for information that leads to the arrest and conviction of the persons responsible for his death. PTI","Sep 17, 2020
                            ,01:21 PM (IST),9 days ago                            ","FBI announces reward of $15,000 for information on the murder of Indian national in 2012"
"Over 11,600 Indians abroad have been infected with coronavirus as per details available with the country's missions, the government informed the Rajya Sabha on Thursday.,In a written reply to a question in the Upper House, Minister of State for External Affairs V Muraleedharan said Indian Missions arranged for the welfare of Indian nationals, where required, including through the Indian community associations.,In some cases, arrangements were also made for screening and testing of stranded Indian nationals to enable them to return to India, as also for movement of patients via air ambulances for their treatment in India, he said.,""As on September 10, 2020, as per the details available with Indian missions, the total number of Indian citizens abroad infected with coronavirus stood at 11,616,"" he said.,Out of the 11,616 Indians infected with COVID-19 abroad, 4,618 were in Singapore, 2,639 in Bahrain, 1,769 in Kuwait, 907 in Oman, 420 in Qatar, 308 in Iran, 238 in the UAE and 192 in Italy.,During the COVID-19 pandemic, India has supported 150 countries with medicines and medical equipment, including around 80 countries under grants-in-aid, he said.,In response to another question on the Vande Bharat Mission, Muraleedharan said the mission was launched on May 7, 2020 and more than 14,12,835 Indian nationals have returned to India via air, land and sea.,To another question on the number of Indians abroad at present who have registered with the Vande Bharat Mission to return to India but have still not returned, Muraleedharan said according to the information available with the ministry, 4,80,738 Indians who have registered on MEA's online 'REPAT' portal have not yet returned.,""The actual number of people wishing to return may differ. As per information provided by the missions, many people who have registered may no longer wish to return. Moreover, as per latest guidelines of Government of India, passengers are no longer required to register for Air Bubble flights,"" he said.,""Most people with compelling reasons have safely returned to their homes by air, land and sea. The exercise to bring back stranded Indians is ongoing under the Vande Bharat Mission,"" he said.,""Our Missions have assisted more than 62,000 Indian nationals in distress involving an expenditure of nearly Rs 22.5 crores from the Indian Community Welfare Fund,"" he said.,Responding to a separate question on the number of students and workers brought back under the Vande Bharat Mission, Muraleedharan said 56,630 students and 3,08,099 workers had been brought back.,Asked about the details of the facilities being given to the workers brought back to the country, the minister said, ""With the aim of making the best of our skilled workforce returning to the country due to the ongoing pandemic, the Government of India launched an initiative SWADES (Skilled Workers Arrival Database for Employment Support) to conduct a skill mapping exercise of the returning citizens under the Vande Bharat Mission."",SWADES, a joint initiative of the Ministry of Skill Development and Entrepreneurship, the Ministry of Civil Aviation and the Ministry of External Affairs, is aimed to create a database of qualified citizens based on their skill sets and experience to tap into and fulfil demand of Indian and foreign companies.,This was done to facilitate reintegration of migrant workers into the labour market and promote effective employment opportunities, he said.,""For facilitating employment opportunities, details of SWADES registrations have been integrated with Skill India's ASEEM (Aatmanirbhar Skilled Employee Employer Mapping) portal which was launched on July 10, 2020,"" he said.,All data regarding Indians returning under Vande Bharat Mission was also shared with relevant state governments, on a real time basis, he said.,Muraleedharan also asserted that there was no delay in bringing back workers who were stuck in various countries in the Gulf region.,He said priority has been given to countries in the Gulf region for scheduling flights to bring back the stranded workers under the Vande Bharat Mission. ","Sep 17, 2020
                            ,05:42 PM (IST),9 days ago                            ","11,616 Indians abroad infected with coronavirus: MEA"
"Washington, September 18,An Indian-American federal judge has turned down an appeal by 169 Indian citizens who had challenged the proclamation of President Donald Trump that barred foreign nationals on H-1B speciality occupation visa from entering the US till the end of the year.,The H-1B visa is a non-immigrant visa that allows US companies to employ foreign workers in speciality occupations that require theoretical or technical expertise. The technology companies depend on it to hire tens of thousands of employees each year from countries namely India and China.,US District Judge Amit P Mehta of the US District Court for the District of Columbia in its order on Wednesday said Indian citizens, who were now trapped abroad during trips to India when borders closed, were unlikely to win their case contesting the travel ban proclamation of Trump.,“The 169 Indian nationals in their lawsuit had sought an order directing the Secretary of State and the United States consulates to process, adjudicate, and render final decisions on Plaintiffs’ DS-160 visa applications. But requiring such swift processing would be an exercise in futility when the complainant would remain ineligible to enter the country until January 1, 2021, at the earliest,” Mehta said.,Such an order would risk diverting limited resources away from visa applicants who were eligible under an exception to the proclamation and could create substantial confusion for visa recipients attempting to enter the country only to be denied at ports of entry, he said.,Mehta said on the merits, the court has already determined that the Indian nationals, who had filed the lawsuit and were stuck in India, are unlikely to succeed on their ultra vires challenge to the proclamation and were likely to succeed on their Administrative Procedure Act challenge that their suspension of processing their visas pursuant to the Proclamation was arbitrary and capricious.,The lawsuit was filed by Indian nationals who were recently residing in the United States in lawful non-immigrant status under temporary labour petitions approved by the Department of Homeland Security. For various reasons, they travelled to India and now must receive visas to return to the US.,Indian nationals on H-1B visas alleged that the United States consular offices, acting under the direction of the Secretary of Homeland Security and the Secretary of State, has withheld the adjudication of their visa applications pursuant to the President’s recently issued Presidential Proclamation 10052 (dated June 22, 2020).,The proclamation suspends the entry of foreign nationals within certain categories of non-immigrant visas.,In his 11-page order, Judge Mehta at the same time noted that the visa hopefuls are likely to convince the court that the Trump administration must continue processing their visas despite the entry restrictions.,“But since they are unlikely to secure an end to those entry bars, requiring the US Department of State to nonetheless process their visa requests would be an exercise in futility,” he said.,“Such an order would risk diverting limited resources away from visa applicants who are eligible under an exception to the proclamation and could create substantial confusion for visa recipients attempting to enter the country only to be denied at ports of entry,” Mehta wrote.,Attorneys for the Indian nationals have filed a notice indicating their plans to appeal the ruling to the DC Circuit. PTI","Sep 18, 2020
                            ,11:49 AM (IST),8 days ago                            ",US court turns down challenge to Trump’s temporary ban on H-1B
"Biden was assured 66 per cent of the Indian-American votes and Trump of only 28 per cent if the election was held on the day they were polled, the 2020 Asian American Voter Survey (AAVS) has found.,But Trump's backers have increased by 12 per cent since 2016.,Hillary Clinton, who ran against him on the Democratic ticket, received 77 per cent of the Indian-American votes to only 16 per cent that Trump got, according to the 2016 Post-Election National Asian American Survey.,There appears to be an 11 per cent erosion in support for the Democratic Party in the last four years.,However, Biden's margin of 38 per cent over Trump among the Indian-Americans is still more than six times the margin in the national polls covering all ethnicities.,The RealClearPolitics aggregation of national polls on Wednesday showed Biden having only a 5.9 per cent lead, with 49 per cent support compared to 43.1 per cent for Trump.,Speaking at a panel discussion during the release of the report on Tuesday, Niraj Antani, a Republican Ohio State assembly member, described the increase in Trump's support among Indian-Americans to his outreach to them, his India visit and his neutrality on issues like the Citizenship Amendment Act and the ending of Kashmir's special constitutional status.,""Biden's opposition to those issues have sort of polarised the community,"" he said.,Raja Krishnamoorthi, a Democratic member of the House of Representatives from Illinois, said that Biden has to conduct ""a vigorous outreach"" to the Indian-American community.,But he said that Indian-Americans should ""absolutely not"" worry about India losing support under Biden and Harris because he ""has been a stalwart friend of India through different prime ministers"".,US-India relations transcends partisanship in the US, he said, adding: ""As a member of the House Intelligence Committee, I can tell you for a fact that our national security is bound up with the security of India"" because of the China factor and US-India relations are going to grow closer.,The influence of Harris is not fully factored into the AAVS because her pick as the Vice Presidential nominee was announced only on August 11, midway through the poll between July 15 and September 10.,Krishnamoorthi said Harris's nomination is going to be ""a big play"" in the Indian community.,She should ""talk a little more about her biography, talk about her Indian heritage and her roots and talk about how that informed and influenced who she is today"", he said.,Ninety-eight per cent of Indian-Americans have planned to vote in the November election, according to the AAVS produced by APIAVote, AAPI Data, and Asian Americans Advancing Justice.,And 58 per cent said they were more enthusiastic about voting this year.,While the percentage of Indian-Americans who back the Democratic Party candidate has come down, the party has solidified its base in the community.,The percentage of those who consider themselves Democrats has increased to 54, up by 8 per cent from 46 per cent in the 2016 survey.,Those who consider themselves Republican has meanwhile dropped to 16 per cent from 19 per cent in 2016. Those who consider themselves independent has also fallen from 35 per cent to 24 per cent in the four years.,The survey showed that 44 per cent Indian-Americans had a ""somewhat favourable"" view of Biden and 26 per cent ""very favourable"" view of him, with only 14 per cent having a ""very unfavourable"" view and six per cent are somewhat unfavourable"".,In contrast, 54 per cent of Indian-Americans had a ""very unfavourable"" view of Trump and 8 per cent ""somewhat unfavourable"".,Only 20 per cent had ""very favourable"" views of him and 16 per cent ""somewhat unfavourable"".,Karthick Ramakrishnan, the director of AAPIData, said that the high unfavourable rate for Trump ""really limits his ability to make much more headway in the Indian-American population"".,The survey showed that Indian-Americans were overwhelmingly liberal in their outlook, both political and social.,Indian-Americans are concerned about growing inequality with 40 per cent saying that it was an extremely important issue, 38 per cent a very important issue and 20 per cent somewhat an important issue.,Sixty-eight per cent of Indian-Americans said there was a lot of discrimination against Muslims in US society, 21 per cent some discrimination and only 9 per cent none.,Sixty per cent of Indian-Americans agreed strongly and 22 per cent ""somewhat strongly"" that the government should do more to give Blacks equal rights with whites, and 38 per cent had very favourable views of the Black Lives Matter movement, and 32 per cent ""somewhat favourable"" views Thirty-eight per cent of Indian-Americans considered policing reforms extremely important, 46 per cent very important and 10 per cent somewhat important.,On government size, 56 per cent of Indian-Americans backed having a bigger government, while 22 per cent favoured smaller one.,Eighty-six per cent of Indian-Americans were supportive of affirmative action programmes that give preference in jobs and admissions to educational institutions.,There is concern over foreign interference in US elections and 43 per cent of Indian-Americans worry about frequently, 23 per cent somewhat frequently and 18 per cent never.,The only area where there wasn't a huge difference in perceptions of Democrats and Republicans was in dealing with the economy and jobs: 39 per cent of Indian-Americans said Democrats did a better job and 31 per cent Republicans, while 27 per cent saw no difference between the two parties.,The Asian American Survey 2020 was carried out by Asian and Pacific Islander American Vote, Asian American Pacific Islander Data and Asian Americans Advancing Justice surveyed members of all Asian ethnic groups around the country.,The survey to gauge Asian views on a number of subjects included 250 Indian Americans and the breakdown of their views by the community was given.--IANS","Sep 17, 2020
                            ,11:07 AM (IST),9 days ago                            ","Trump makes headway among Indian-Americans, but Biden has huge lead"
"Singapore, September 18,A 53-year-old Indian-origin man, who is suffering from delusional disorder, was on Friday sentenced to 10 years of jail for stabbing his wife to death as he suspected her of having an extramarital affair, a media report said.,Krishnan Raju, a self-employed bus driver ferrying factory workers and tourists, married Raithena Vaithena Samy when she was 17 and was “very possessive of her” throughout the relationship of 28 years, Channel News Asia reported.,Raju suffered from delusional disorder—a belief or altered reality that is persistently held despite evidence or agreement to the contrary, generally in reference to a mental disorder—and had developed trust issues.,He started suspecting her of having an extramarital affair and often confronted her over the issue.,In November 2016 Krishnan stabbed his wife at their Loyang Gardens condominium residence and fled to his brother’s place in Johor Bahru in Peninsula Malaysia, the report said.,Krishnan pleaded guilty in July to a charge of culpable homicide for killing his wife.,He was originally charged with murder for the killing, in which he inflicted 13 stab wounds on his wife, five of which were on the chest.,During the trial, the prosecution had asked for 12 years’ jail while the defence asked for a maximum of eight.,The Judge, Justice Hoo Sheau Peng, agreed with the prosecution psychiatrist’s diagnosis that Krishnan was suffering from acute alcohol intoxication at the time, which contributed to the offending and impaired his attention or memory.,“I also note that the accused was, and is, remorseful,” said Hoo.,“This is demonstrated by his attempts to kill himself after the attack, his surrender to the authorities the very next day, his expressions of remorse in his statements and his plea of guilt,” she said.,For culpable homicide not amounting to murder, he could have been jailed for life. PTI","Sep 18, 2020
                            ,04:45 PM (IST),8 days ago                            ",Indian man jailed for 10 years for killing wife over suspicion of extramarital affair: Report
