content,time,title
"Sacha Deshmukh, the Indian-origin chief of the UK arm of the United Nations Children’s Fund (UNICEF), has resigned, months after taking charge of the post after raising bullying concerns against the UN charity’s chair.,Deshmukh, who took over as the Executive Director of UNICEF UK in April, is believed to have raised some concerns around bullying behaviour by a senior.,“The board of trustees of UNICEF UK announces with regret that it has accepted the resignation of Executive Director Sacha Deshmukh. He will remain in post until the new interim leadership is announced. The search for a new Executive Director will start immediately,” a UNICEF UK statement said on Wednesday.,“In the meantime, the board has every confidence in the strengths of the existing executive team and the dedicated staff as a whole to take forward the charity at this vital time with its work focused on improving the lives of the world’s children,” it said.,According to the charity sector publication ‘The Third Sector’, Deshmukh is said to have called for an investigation into the allegations of bullying against Douglas Alexander – a former UK government minister who has been Chair of UNICEF UK since 2018.,He reportedly raised concerns with the board of trustees last month that about 10 staff had experienced similar patterns of “aggressive and bullying behaviour”.,“These allegations come as a surprise to the board as no formal complaint has ever been received regarding any of these issues.,“However, as you would expect, we take this very seriously and a full internal review has been launched today – carried out by two trustees and one external adviser – and they will report back to the board as quickly as possible. It would be wrong to discuss this further while the investigation is ongoing,” a UNICEF UK spokesperson said, adding that Alexander continues to have the support of the board.,Deshmukh is understood to be disappointed to be leaving the charity, which he feels strongly committed to despite the alleged events.,“After many years of admiring UNICEF UK, it is an amazing privilege to be joining its team and become a part of the UNICEF family,” he had said at the time of his appointment to the post earlier this year.,“UNICEF’s work supporting children worldwide and in the UK is more important than ever before. Globally, one in four children are affected by war, and UNICEF’s engagement with generous supporters in the UK is critical to providing vital support to children around the world. I am looking forward to working with an incredible group of colleagues as we create the next exciting chapter for UNICEF UK in the 2020s,” he said at that time.,Alexander, as Chair of Trustees, had praised Deshmukh’s “impressive record” of achievement in the public, private and non-profit sectors.,“Sacha absolutely shares our passion for working to address the needs of the world’s most vulnerable children and young people… The Board and I are looking forward immensely to working with Sacha to build an ever stronger, more impactful UNICEF UK together,” he said in January.,Deshmukh joined UNICEF UK from Smart Energy GB, the government-backed campaign to help people understand smart energy meters, where he had been Chief Executive since 2013.,He has previously spoken about his Indian heritage and historic connect with UNICEF, following his father’s migration from Pakistan to India as a young refugee post-Partition in 1948.,His father later came to England in 1962 in pursuit of a university education and met his mother when she stopped off in the UK on her way to the US in 1968.,Deshmukh grew up in west London before going on to study at Cambridge University. PTI","Sep 24, 2020
                            ,09:21 PM (IST),1 day ago                            ",Indian-origin UNICEF UK chief quits after raising bullying concerns
"Indian Americans, with their hard work and entrepreneurship, have powered the economic growth of the United States and helped forge cultural dynamism in the country, Democratic presidential candidate and former vice president Joe Biden said on Tuesday.,Addressing a national virtual fundraiser organised by Indian Americans, Biden assured the community members and the mega donors that as a president, he would address their concerns with regard to H-1B visa and legal immigrants that attract the best and the brightest to the US.,Think about what this community has done for the country, he said. Entrepreneurs running businesses around the country and around the world, innovators who make the foundation for Silicon Valley and lead some of the most influential companies in the world come from the community, the former vice president said.,""You have helped forge an economic and cultural dynamism in this country. That is a continuation of who we are, we are a nation of immigrants,"" Biden said.,Hitting out at President Donald Trump, he said all the harmful actions on H-1B, racial injustice or climate crisis are a common threat.,""This president makes things worse, not better,"" Biden added.,It makes parents wonder whether their kids will have the kind of future they dreamed of when they came here, he said.,""As president, I promise I am going to draw on the best, not the worst, beat this pandemic and build the economy back, help our kids get a good education and make sure healthcare is a right not a privilege, and build an immigration system that powers our economy and reflects our values,"" Biden said.,""We do not talk enough about how the Indian American community has powered our economic growth,"" the former vice president said in his address to the virtual fundraiser, which according to his spokesperson Remi Yamamoto was attended by 268 people.,Highly appreciative of the cultural, social and family values of Indian Americans, Biden said that is why he values the Indian American Diaspora so much.,Seema Sadanandan, a senior policy adviser to the campaign, opened the fundraiser and asked Dr Vivek Murthy, former surgeon general, to start off by talking about his relationship with Biden. Family was the main theme of the conversation with a few references thrown in about Indian food.,""Joe Biden is the kind of guy I would love to bring home to have dinner with my mom and dad,"" Murthy said in his opening remarks, adding that some homemade masala dosa would be served.,""He is authentic. He is real. And he says what he thinks and that is something I really love about him. He says what is on his mind. He is honest and true,"" he said.,Biden, Murthy said, is a man who generally meets with his values and those values are reliably centred around generosity and community. ""It is who he is,"" Murthy said.,In a statement, Ajay Jain Bhutoria, Asian American Pacific Islander Leadership Council and National Finance Committee member of the Biden campaign, said the former vice president will bring hope, unity, change and healing to the country.,""He will restore the soul of America and its glorious position on the world stage. He will be the best friend of India and Indo-Americans. He will streamline H1Bs, remove green card backlogs, sign new trade deals, implement climate change agreements, protect us against hate crimes, guard our places of worship and ensure that South Asians are well represented in his administration,"" Bhutoria said. ","Sep 23, 2020
                            ,10:04 AM (IST),3 days ago                            ",Indian Americans have powered economic growth of US: Joe Biden
"A Republican campaign video that includes visuals from the two historic rallies of President Donald Trump and Prime Minister Narendra Modi in the last one year—“Howdy, Modi!” and “Namaste Trump”—is making waves in the US ahead of the November 3 presidential election, particularly among Indian-Americans whose votes may be the deciding factor in some of the battleground states.,Titled “4 More Years”, the 107-second video starts with footage of Modi and Trump walking hand-in-hand at the NRG Stadium in Houston during the Indian prime minister’s visit to the US last year, amidst 50,000 cheering supporters.,In the background, Modi is heard saying, “He needs no introduction. His name comes up in almost every conversation. The President of the United States of America, Mr Donald Trump.”  ,The video then cuts to the two leaders, along with US First Lady Melania Trump, waving at a massive crowd in Ahmedabad during the Namaste Trump event in February this year.,The video ends with Trump pledging American loyalty to India.,“America loves India. America respects India. America will always be faithful and loyal friends to the Indian people,” Trump is heard in the video.,Indian-American psychiatrist Dr Maya Puri said, “When I first saw the “4 More Years” video, it sent chills down my spine. I had a visceral reaction to it. I literally wanted to stand up and cheer. It brought tears to my eyes.”             ,The “4 More Years” video was released by the Trump Campaign during the Republican National Convention last month.,“It (the video) really speaks to me emotionally as an Indian, as an American, as a Trump supporter, as a patriot, and just on a human level. It just packs a punch and hits you in the gut—in the best possible way of course! I don’t recall being so moved by a one-and-a-half-minute video ever before,” said Dr Puri.,Republicans are excited about the video’s popularity, considering the effect it could have on some of the battleground states.,The swing states of Michigan, Pennsylvania, and Ohio are bastions to neither the Republicans nor the Democrats and a solidified base of Indian-American votes could be a deciding factor in the presidential election.,President Trump and Vice President Mike Pence will be challenged by Democratic Party presidential candidate Joe Biden and his Indian-American running mate Kamala Harris in the November presidential election.,Other than being present on all major social networking sites and video-sharing platforms, the video has been shared by national chair of Trump Victory Finance Committee 2020 Kimberly Guilfoyle and the president’s eldest son Donald J Trump Jr.,“The power of friendship between these two world leaders is truly awe-inspiring. It’s something that I would strongly recommend every Indian and non-Indian to watch for themselves to have that ‘feel-good’ experience which I truly think is good for the soul,” said Dr Puri.,Prem Parameswaran, global chief financial officer of Eros International PLC, said Trump loves India and the Indian community.,“He has done more for Indian-Americans than any other president in our history. He has forged a very special relationship with Prime Minister Modi and now we have the two largest democracies united. This is a terrific video and I fully support President Trump for another four years!” said Parameswaran, who is a member of President Donald J Trump’s Advisory Commission on Asian Americans and Pacific Islanders (AAPI).,Sridhar Chityala, a member of Indian Voices for Trump, said the video is impactful and captures the strong leadership of the two heads of state.,“It would rank with any classical theatrical production that is to be released with a teaser trailer. The video does full justice to the Trump-Modi partnership built on trust, respect, recognition,” Chityala said.,A prominent Trump supporter, Al Mason, who conceptualised the video, said if Trump gets another four years at the White House it will massively boost the India-US partnership. Mason is co-chair of the Trump Victory Indian American Finance Committee.,The “4 More Years” video has been viewed more than 3,00,000 times on Twitter alone. It has been viewed several hundred-thousand times more on Facebook, Instagram and WhatsApp.,Indian-American Danny Gaikwad described the video’s popularity as “hitting a home run in the Indian Diaspora”.              ,With an aggressive China knocking on India’s doorstep, it is more than ever we need a very strong friend in the White House, like the president who will stand unequivocally for Modi and for India, said Dr Raj Bhayani. PTI","Sep 09, 2020
                            ,11:40 AM (IST),17 days ago                            ",US election: Republican campaign video featuring PM Modi woos Indian-American voters
"Singapore, September 9,More and more Indian workers are returning home as Singapore businesses cut down on workforce following the severe impact of the novel coronavirus pandemic, an official said.,""On an average, about 100 Indian nationals in Singapore continue to register daily with the High Commission here for flights back home, with over 11,000 having registered so far,"" Indian High Commissioner P Kumaran said on Wednesday.,Special flights have been arranged as part of the ongoing Vande Bharat Mission and, wherever necessary, more flights are added to help meet the high demand for some destinations to help Indian nationals return home as they have lost their jobs, or going back for medical treatment or family-distress situation, he said.,Kumaran said the high commission would continue to work to ensure enough repatriation flights, even though formal flights between Singapore and India had not resumed.,The high commission has repatriated over 17,000 Indian nationals by arranging 120 special flights since May, said Kumaran.,Speaking to PTI, the envoy also listed out his priorities in working on the India-Singapore relationship during his tenure here, especially further intensifying the political engagement, focus on increasing trade and investment flows, and technology collaborations in the space of fintech and startups.,""We have planned an India-ASEAN hackathon later this year, as part of similar hackathons done between Indian and Singapore in the past,"" he said. ""We are also working further on other collaboration opportunities such as enabling digital payments in Singapore through Indian domestic RuPay cards, working together to develop a Global Stack, on the lines of India Stack, and for making our MSME platforms interoperable."",Discussions are on with the Singapore Manufacturing Federation (SMF) to explore opportunities for a manufacturing partnership.,""India offers industrial sites in planned economic zones to promote manufacturing,"" he said, stressing that the country had ""a very cost competitive"" manufacturing ecosystem, especially its low labour cost.,Singapore, through regionally-linked institutions and trade bodies such as the SMF, as well as a good understanding of the ASEAN market, offers good scope for such a win-win partnership.,""This perfectly fits into the India's strategy to be a global manufacturing hub with Singapore's investment in specialised manufacturing sectors and cooperation in the area of developing the required skills for Indian workers,"" Kumaran said.,""Singapore has been a longstanding FDI source for the Indian market and, by expanding collaborations with SMF, we aim to bring in more industries into the manufacturing sector in the country,"" said Kumaran.,Investors see India as a long-term market with a growing domestic demand and the ongoing economic reforms creating a business-friendly environment as well as government's support for export-oriented industries, according to Kumaran.,Separately, the high commissioner is also set to start work on India's new High Commission building at Stevens Road on the outskirts of the hotel-belt of Orchard Road and the central business district.,It is designed to be a multi-storey complex on the free-hold land parcel owned by the Indian government, along with the current chancery and the High Commissioner's residence.,""We are looking at completing the Indian High Commission's new complex in about three years,"" said the envoy. PTI","Sep 09, 2020
                            ,09:38 AM (IST),17 days ago                            ",More Indians in Singapore returning home due to job losses: Envoy
"Toronto, September 25,The Canada India Foundation (CIF) has announced to donate C$21,000 to the langar at the Golden Temple in Amritsar where over 100,000 people eat free meals each day.,The Foundation, which also honours a prominent Indian from anywhere in the world with the Global Indian Award each year, is donating to the langar after the amended Foreign Contribution (Regulation) Act granted registration to the Golden Temple to receive direct foreign donations.,“We were very excited to hear the news that people from all over the world can now directly donate to the Golden Temple langar seva. We at the CIF want to be among the first to show our appreciation,” CIF chairman Satish Thakkar said.,Thakkar thanked India for fulfilling the long-pending demand of the Indo-Canadian diaspora to make direct donations to the world’s biggest langar at the Golden Temple.,“Thousands of devotees from Canada were prevented from sending money to the langar seva because of the stringent provisions of the FCRA. The Indo-Canadian community has reacted favourably to the Indian announcement,” added Foundation convenor Ritesh Malik.,Toronto Sikh Bhupinder Singh Khalsa, founder member of the Foundation, said: “I feel blessed that now sitting in Canada I can send my humble contribution to the langar. Though Canada has always given us every opportunity to stay connected to our roots, culture and religion, this is a great step by India to help us to stay connected to the source of our faith.”,Set up in 2007, the CIF is an advocacy group aimed at promoting India-Canada relations.,The Foundation’s C$50,000 Global Indian Award also honours a prominent Indian each year.,The late President APJ Abdul Kalam, industrialist Ratan Tata, Congress leader Sam Pitroda and noted economist Montek Singh Ahluwalia are among the past recipients of this award. IANS","Sep 25, 2020
                            ,10:02 AM (IST),1 day ago                            ",Golden Temple langar gets big donation from Canada India Foundation
"The US will invest US$ 150 million in training for middle-to-high-skilled H-1B occupations in key sectors, including in information technology, which employs tens of thousands of Indian professionals.,The H-1B visa is a non-immigrant visa that allows US companies to employ foreign workers in speciality occupations that require theoretical or technical expertise.,The technology companies depend on it to hire tens of thousands of employees each year from countries like India and China.,According to the Department of Labour, prominent among these sectors are information technology, cybersecurity, advanced manufacturing, transportation, wherein the H-1B One Workforce grant programme would be used to upskill the present workforce and train a new generation of workers to grow the future workforce.,The coronavirus pandemic has not only caused disruptions in the labour market, but also forced many education and training providers and employers to rethink how to deliver training, the department said in a statement.,In this grant programme, the department's Employment and Training Administration has set out to streamline funding and resources to encourage a more integrated workforce system that will push the applicants to provide an innovative mix of training strategies, leveraging innovative modes of training delivery, including online, distance and other technology-enabled learning.,Through local public-private partnerships, the grantees will deploy training to provide individuals in their communities with skills necessary to advance career pathways to employment in middle-to-high-skilled H-1B occupations within key industry sectors.,The training models will include a broad range of classroom and on-the-job training, customised training, incumbent worker training, registered apprenticeship programmes and industry-recognised apprenticeship programmes.,""The US Department of Labor is challenging communities to think as 'One Workforce',"" Assistant Secretary for Employment and Training John Pallasch said.,""In the current job environment, it is critical that local organisations work as one, instead of independent parts of a process. Our goal is to create seamless community partnerships to build career pathways for local job seekers to enter middle-to-high-skilled occupations in the cybersecurity, advanced manufacturing and transportation sectors,"" he said.,Public-private partnerships will leverage resources across federal, state and local funding streams as well as from the private sector to support training, employment services and supportive services to maximise access to employment opportunities, the official statement said.,These partnerships will work toward a coordinated approach to preparing a skilled workforce within an economic region. All applicants must demonstrate that they are leveraging at least 25 per cent of the grant funds requested, it added. ","Sep 25, 2020
                            ,09:25 AM (IST),1 day ago                            ",$150 million US plan for H-1B ‘One Workforce’ training programme to benefit Indians
"Indian-Americans, particularly in the battleground states, are coming out in support of President Donald Trump in large numbers due to a combination of 12 factors, prominent among, which is his friendship with Prime Minister Narendra Modi, according to an internal research survey.,Trump showing respect to Indian-Americans, treating India and Modi on an equal footing have made him popular, says the survey, which is now shaping the campaign's outreach towards the community in the last 40 days.,According to the survey carried out by Al Mason, co-chair of the Trump Victory Indian American Finance Committee, and his team, the Trump administration, unlike the president's predecessors and the current challenger, staying away from the internal affairs of India, in particular on issues like Kashmir, the president's visible role in elevating India's stature on the world stage are some of the other key factors.,""It is mostly about the Trump-Modi factor,"" the survey said, adding that Indian Americans increasingly believe that the teamwork of Trump and Modi over the next four years will successfully checkmate China at the world stage.,Other factors such as Trump's strong stand against China, him being a man of peace rather than throwing the country into war, America's economic revival to the pre-COVID-19 era and his competent handling of the pandemic are driving Indian Americans towards Trump, the survey said.,""Trump has elevated India's stature on the world stage. Of course, due credit also goes to Prime Minister Narendra Modi for his skilled policy towards the US. The India-US relationship has been rock solid. Kudos to the brilliance of both Trump and Modi for cementing the bond between India and US,"" says the survey. ""His family echoes the same sentiments,"" it said.,""Every Indian-American in the US has a family member back home like old parents, brother, sister, friend, business. They want India to be respected and protected from China, which is what Trump can provide. They fear that without Trump, China would start a war with India,"" notes the memo, which is playing a key role in the campaign, devising its outreach strategy towards the Indian American community.,In many must-win battleground states, Indian Americans comprise a substantial and potentially decisive share of the electorate: 190,000 potential voters in Florida, 120,000 in Michigan, 170,000 in Pennsylvania, 150,000 in Georgia, 110,000 in North Carolina, 165,000 in Virginia, and nearly 470,000 in Texas.,The survey results of Mason and his team show that as many as 50 per cent of the potential Indian American voters, the vast majority of whom have traditionally voted Democratic in the presidential elections, will defect from the Democratic Party and vote for Trump.,""This mass defection could add tens of thousands of new Trump voters in key battleground states and could very well end up helping to secure the president's re-election,"" said the survey.,""Biden, Harris, Democrats and Trump haters fear Mason as he is the one who has orchestrated the mass exodus of Indian Americans in the battleground states towards Trump by his research, views and messaging,"" said venture capitalist Sridhar Chityala, who is also a member of the Indian Voices for Trump.,""They fear him because the video ""4 More years"", conceptualised by him and launched by Kimberly Guilfoyle and Donald Trump Jr, has crossed the 10 million-mark and resonates with the community. Al Mason's fundraising efforts also yield results,"" said Chityala.,""I felt excited watching Modi greet Trump and introducing him to over 100,000 Gujaratis as his family and 1.5 billion Indians on television. Actually, it brought tears of joy to me,"" said Girish Gandhi from Florida.,""I am pleased with the accomplishments and support from Trump on Modi's transformational bold initiatives in India, especially on resolving the Kashmir issue, abolition of Article 370 and the Citizenship (Amendment) Act (CAA). I look forward to great things to come in 2021 and beyond for both countries under the Trump-Modi leadership,"" said Dr Anand Tamhankar, physician consultant and an entrepreneur in New Jersey. PTI","Sep 24, 2020
                            ,09:38 AM (IST),2 days ago                            ",Trump-Modi 'friendship' driving Indian-Americans towards US President: Survey
