content,time,title
"The UAE and India should have an open sky policy instead of an air service agreement between them, the Gulf nation's Ambassador to India Ahmed Al Banna said on Wednesday, asserting that such a move would benefit airlines of both countries.,The UAE is India's trusted partner and its investment commitment is a testimony of its confidence in the economic growth story of India, Al Banna said at a webinar.,The UAE is the largest Arab investor in India having a share of about 85 per cent of the total Arab investment in the country, he said.,""There exists immense untapped growth potential in many different sectors. The UAE wants to be the preferred economic partner of India, and we want to work closely with India to improve on many different levels,"" Al Banna said at the webinar organised by Vijay Jolly, President of the Delhi Study Group.,One of the most important aspects is the improvement of air connectivity which is yet another important economic growth catalyst that facilitates trade and tourism, he said.,""We have 1,068 flights between the UAE and India. More than 50 or 55 per cent of Indians who travel outside India, they use Dubai and Abu Dhabi as their transit points,"" he said.,""We need to look into having what we call an open sky policy, instead of having an air service agreement, which is limited in terms of capacity, in the number of seats,"" Al Banna said.,Calling for a rethink on the issue, the UAE envoy said the two sides should look for a stronger collaboration wherein both Indian and UAE airlines would benefit.,An open sky air service agreement allows for airlines from the two countries to have an unlimited number of flights as well as seats to each other's jurisdictions.,The National Civil Aviation Policy, 2016, allows the government to enter into an 'open sky' air services agreement on a reciprocal basis with SAARC nations as well as countries beyond a 5,000-kilometre radius from New Delhi.,India has signed open sky agreements with the US, Greece, Jamaica, Guyana, Finland, Spain and Sri Lanka, among other countries. ","Sep 09, 2020
                            ,06:34 PM (IST),17 days ago                            ","UAE, India should have open sky policy instead of service agreement: Envoy"
"An Indian-origin Facebook engineer Ashok Chandwaney has quit the company, accusing the social network of ""profiting off hate"" in the US and globally.,Chandwaney who worked at Facebook for more than five years slammed the social media giant for its inability to combat the spread of hate speech and misinformation and incitements to violence on its platform.,""I'm quitting because I can no longer stomach contributing to an organization that is profiting off hate in the U.S. and globally,"" Chandwaney wrote in a Facebook post this week.,Chandwaney wrote about the genocide of Rohingyas in Myanmar and a militia group's post calling for armed civilians to enter Kenosha, Wisconsin, during the Jacob Blake protests.,""Violent hate groups and far-right militias are out there, and they're using Facebook to recruit and radicalize people who will go on to commit violent hate crimes. So where's the metric about this?"" he wrote.,Following a shooting that left two people dead, Facebook finally pulled down the Kenosha militia post. Zuckerberg blamed an ""operational mistake"" by the third-party contractors and reviewers who failed to remove the Kenosha Guard militia Page and Event prior to the shooting in Wisconsin in the US that left two dead last month.,Last month, four rights groups claimed that the social networking giant played a role in the 2017 violence in Myanmar that forced hundreds of thousands of Rohingyas to seek refuge in Bangladesh. The rights groups demanded that Facebook help the Rohingya refugees to get justice.,""Facebook is choosing to be on the wrong side of history,"" Chandwaney said in his resignation letter.,""We continue to pass the buck with the Kenosha Guard failure being pinned on contract content moderators, who are underpaid and under-supported in their jobs - both of which are things Facebook could almost instantly fix if it so chose,"" he said.,""It seems that Facebook hasn't found the business value to be had in aggressively pursuing the existing credible strategies to remove hate from the platform - despite pressure from civil society, our own employees, our own consultants, and our own customers via the boycott"".","Sep 10, 2020
                            ,10:12 AM (IST),16 days ago                            ","Indian-origin FB worker quits, slams it for 'profiting off hate'"
"Washington, September 11,Democratic Party members have released a musical video remix of popular ‘Chale chalo’ song from the Bollywood movie, 'Lagaan', to woo Indian-American voters ahead of the US presidential election.,In the November 3 election, Democratic presidential candidate Joe Biden and his Indian-American running mate Kamala Harris will challenge incumbent Republican President Donald Trump and Vice President Mike Pence.,""Chale chalo, chale chalo, Biden ko vote do, Biden ki jeet ho, unki haar haan,"" says the lyrics of the song sung by Silicon Valley-based Bollywood singer Titli Banerjee and released by entrepreneur couple Ajay and Vinita Bhutoria.,""It is a war-fighting song, drawing from the energy of Indian celebrations, inspiring our community to awaken and vote for Biden-Harris in November,” Bhutoria said after the video was released on various social media platforms on Thursday.,This is the second national Indian-American outreach video that the couple has produced to unite all South-Asians and people of Indian-origin to support Biden and Harris. Born to a Jamaican father and an Indian mother, Harris is the first Indian-American and first Black woman to be picked by a major American political party for the top post.,""South Asians for Biden is thrilled to serve as a partner on this important video, which encourages Indian-Americans to vote for Vice President Joe Biden and Senator Kamala Harris,"" said Neha Dewan, National Director of South Asians for Biden.,""The stakes of this upcoming presidential election could not be higher for the Indian-American community, which is why our diverse community is united behind the Biden-Harris ticket. It is absolutely crucial that we make a show of force of our voting strength. The South Asian community can be the crucial margin of victory this November,"" she said.,Titli Banerjee said getting the right message across during elections through music has been a long-held tradition in India.,“I am glad that I was able to contribute through my voice in recreating that experience and hope that the message to go out and vote for the future of America reaches all Indian-Americans,"" she said.,Referring to the video, Bhutoria, who is also on the National AAPI Leadership Council and the National Finance committee for Biden for President 2020, said it presents the diversity of people in American community inspired by Biden's vision of hope and change.,""We come from all ages, places and professions, but we are united in our passion for a candidate who represents our common values,” he said.,There is an estimated four million Indian-American population of which about 2.5 million are potential voters in the November 2020 presidential election. There are over six million South Asian voters and 1.3 million Indian-American voters in key battleground states, including Texas, Michigan, Florida and Pennsylvania.,Bhutoria claimed that over 80 per cent of the South Asians are supporting the Biden-Harris ticket.,“We believe that we (South Asians) can help power Vice President Biden and Senator Harris to victory,” he asserted.,The video outreach is supported by South Asians for Biden, Impact Fund, They SeeBlue, Indians for Biden National leadership council and several other South Asian organisations. It will also be shared by Asian Americans and Pacific Islanders (AAPI) for the Biden team, according to a media statement.,The video was created by Ritesh of Awesome TV.,“We wanted to make it simple, memorable, inspirational and awesome,” he said. PTI ","Sep 11, 2020
                            ,01:41 PM (IST),15 days ago                            ",Biden supporters release remix of Bollywood song to woo Indian-Americans
"Singapore, September 13,Eight of the 10 imported COVID-19 cases reported in Singapore came from India, the Health Ministry said on Sunday.,Two of those eight were Singaporeans and five permanent residents who returned on August 30-31. The other one was a short-term visit pass holder and a spouse of a Singaporean, who arrived from India on September 5.,The other two imported patients are work pass holders employed here who arrived here from Germany on August 30 and the Philippines on August 29.,Singapore reported 49 new COVID-19 infections on Sunday, taking the national tally of cases to 57,406. The sole community infection is a foreigner holding work pass, officials said.,All eight imported cases had been placed on stay-home notice upon their arrival in Singapore. PTI","Sep 13, 2020
                            ,02:30 PM (IST),13 days ago                            ",Eight of 10 imported COVID-19 cases in Singapore came from India
"Democratic vice-presidential candidate Kamala Harris has said her mother Shyamala Gopalan was her source of inspiration who had guided her throughout her entire life.,""My mother always used to say, 'Don't just sit around and complain about things. Do something',"" Harris, 55, wrote in a fundraising email to her supporters on Wednesday. ""Her words have guided me through my entire life, pushing me to take action, solve problems and fight for solutions.""                 ,The Indian-origin senator said it was not a hard decision when Democratic presidential candidate Joe Biden called her to be his running mate.,""I knew I had to do exactly what my mother would have wanted me to do. With so much on the line, I had to do something,"" said Harris, the the first Black woman on a major party vice-presidential ticket.,""I couldn't be more grateful to be a part of this ticket, or more humbled by the outpouring of support Joe and I have received over these past few weeks on the trail. And honestly, we're going to need every ounce of it,” she said, urging her supporters to chip in with their contribution.,Harris has helped not only enthused the party's base, but also helped the campaign raise record amount of money.,During a virtual fundraiser a day earlier, which was hosted by Indian-American  and 'Top Chef' host Padma Lakshmi and actor Billy Porter, Harris spoke about her parents' involvement in civil rights marches when she was growing up in Oakland.,Harris also said she still finds time to cook Sunday dinners for her family despite her hectic schedule and nationwide campaigning as. The Senator also spoke about her mother's cooking, noting that she was an ""extraordinary cook"".,According to Politico, Harris is an enthusiastic cook who bookmarks recipes from the New York Times' cooking section and had tried almost all the recipes from Alice Waters' 'The Art of Simple Food'.   PTI,  LKJ,HMB,09100721,NNNN","Sep 10, 2020
                            ,09:51 AM (IST),16 days ago                            ","Inspired by mother, Harris says she had to do something when 'so much is on the line'"
"An Indian-origin businessman in the UK has been elected as the deputy mayor of London Borough of Southwark for the second time.,Sunil Chopra was the mayor of the London Borough of Southwark in 2014-2015, and deputy mayor in 2013-2014, the first Indian-origin person to hold the prestigious office in the Borough.,New Delhi-born Chopra who was the general secretary of the Indian Overseas Congress, London, is the first and only Indian-origin elected councillor in London Borough of Southwark Council, which has only 2 per cent Indian-origin people.,He is living in London for the last 40 years and actively involved in local community works.,Commenting on his election, Chopra said on Wednesday “I feel really proud to be an Indian. It is not only a great honour for me and my family but for the whole Indian community. I will keep working with the community locally and internationally.” PTI","Sep 09, 2020
                            ,05:11 PM (IST),17 days ago                            ",Indian-origin businessman elected as deputy mayor in UK
"An American commercial cargo spacecraft bound for the International Space Station has been named after fallen NASA astronaut Kalpana Chawla, the first India-born woman to enter space, for her key contributions to human spaceflight.,Northrop Grumman, an American global aerospace and defence technology company, announced that its next Cygnus capsule will be named the ""S.S. Kalpana Chawla"", in memory of the mission specialist who died with her six crewmates aboard the space shuttle Columbia in 2003.,""Today we honour Kalpana Chawla, who made history at @NASA as the first female astronaut of Indian descent. Her contributions to human spaceflight have had a lasting impact,"" the company tweeted on Wednesday.,""Northrop Grumman is proud to name the NG-14 Cygnus spacecraft after former astronaut Kalpana Chawla. It is the company's tradition to name each Cygnus after an individual who has played a pivotal role in human spaceflight,"" the company said on its website.,""Chawla was selected in honour of her prominent place in history as the first woman of Indian descent to go to space,"" it said.,""While Chawla made the ultimate sacrifice in service to the space programme, her legacy lives on through her fellow astronauts and those she has inspired to follow in her footsteps,"" it said.,""Her final research conducted onboard Columbia helped us understand astronaut health and safety during spaceflight. Northrop Grumman is proud to celebrate the life of Kalpana Chawla and her dream of flying through the air and in space,"" it said.,The S S Kalpana Chawla capsule is scheduled to launch on the NG-14 mission atop a Northrop Grumman Antares rocket from the Mid-Atlantic Regional Spaceport (MARS) at NASA's Wallops Flight Facility in Virginia on September 29. The spacecraft will arrive at and be attached to the space station two days later.,For the NG-14 mission, the Cygnus spacecraft will deliver approximately 3,629 kg of cargo to the space station.,Chawla was born in Karnal, Haryana on March 17, 1962. She received a Bachelor of Science degree in aeronautical engineering from Punjab Engineering College in India in 1982.,Chawla then moved to the United States to pursue her graduate education; in 1984 she received a Master's degree in aerospace engineering from the University of Texas, and a Ph.D. in aerospace engineering from the University of Colorado in 1988.,She held commercial pilot's licenses for single- and multi-engine aeroplanes, seaplanes and gliders, and was also a certified flight instructor.,Chawla began her career at NASA in 1988 as a powered-lift computational fluid dynamics researcher at the Ames Research Center in California.,Her work concentrated on the simulation of complex air flows encountered by aircraft flying in “ground-effect.” In 1993, Chawla joined Overset Methods Inc. as vice president and a researcher in aerodynamics.,After becoming a naturalised US citizen in April 1991, Chawla applied for the NASA astronauts corps. She was selected in December 1994 and reported to the Johnson Space Center in Houston in 1995 as an astronaut candidate in Group 15.,In November 1996, Chawla was assigned as a mission specialist on STS-87 aboard the Space Shuttle Columbia, becoming the first woman of Indian descent to fly in space.,Chawla's second spaceflight experience came in 2001 when she was selected for the crew of STS-107. The flight was dedicated to science and research, with approximately 80 experiments completed.,Chawla lost her life during the STS-107 mission when the Space Shuttle Columbia disintegrated upon reentering the Earth's atmosphere. ","Sep 10, 2020
                            ,10:21 AM (IST),15 days ago                            ",US spacecraft named after late Indian-American astronaut Kalpana Chawla
"An Indian expat from Hyderabad has won $1 million at the Dubai Duty-Free (DDF) draw, the media reported.,Laxmi Venkata Tata Rao Grandhi, 34, won $1 million after his ticket number, which he purchased online on August 29, was drawn on Wednesday, reports Gulf News.,A Dubai resident for over a year now and a regular buyer of the lottery, Grandhi said he was ecstatic after hearing his name announced during the live draw on DDF's official Facebook page.,""I'm really glad and thankful to Dubai Duty-Free for this amazing opportunity. This will definitely secure a better future for my family in India,"" said Grandhi, who works as a software engineer for a tech company.,Grandhi is the 168th Indian national to have won $1 million since the start of the Millennium Millionaire promotion in 1999.,Indian nationals make up the highest number of DDF Millennium Millionaire ticket buyers.,--IANS","Sep 10, 2020
                            ,02:21 PM (IST),16 days ago                            ",Indian expat wins $1mn at Dubai Duty-Free draw
"An Indian woman fell to death from the 16th floor of a building in Sharjah, it was reported on Monday.,The incident was reported on Sunday in Sharjah's Al Majaz area, reports the Khaleej Times.,Initial investigations suggest the 26-year-old women ended her life and that there was no foul play.,The police are questioning her relatives and acquaintances to ascertain the circumstances under which the fatal fall happened.,--IANS","Sep 14, 2020
                            ,02:45 PM (IST),12 days ago                            ",Indian woman falls to death from Sharjah building
"London, September 14,An Indian-origin entrepreneur-activist was on Monday dropped as a prospective London mayoral candidate to contest against Sadiq Khan next year after her past antisemitic comments came to light.,Geeta Sidhu Robb, the founder of organic food and juice products firm Nosh Detox, had been shortlisted as the Liberal Democrat candidate to take on Labour’s Khan but was instead suspended from the party after a 1997 General Election footage revealed her making anti-Jewish remarks.,“I apologise profusely for my actions in the 1997 General Election campaign. My behaviour caused offence and hurt and I am deeply sorry,” said Sidhu Robb.,“There is no room for any form of racism or antisemitism in society and as such I very much regret my conduct at that time. It is in no way an excuse, but the context was that I was on the receiving end of a consistent racist campaign and, wrongly, retaliated as I did,” she said.,As a Conservative Party General Election candidate in Blackburn 23 years ago when she was contesting against incumbent Labour MP Jack Straw, Sidhu Robb was filmed saying: “Don’t vote for a Jew, Jack Straw is a Jew.”,The London-based health food promoter, who came second behind Straw in that election, said she was “deeply ashamed” of the language she had used, which she is seen admitting in the footage was done in anger.,“As shown in the footage, I instantly regretted my appalling behaviour, which I continue to do. And I am actively reaching out to the Jewish community to listen and learn,” she said.,“Two wrongs never make a right. I made a mistake and I take responsibility for my abhorrent actions 23 years ago, they were never repeated. I urge you to judge me on who I am today, a campaigner committed to eradicating inequality and discrimination in all its forms,” she added, in a lengthy Twitter statement.,The London mayoral election was due to be held in May this year but has been postponed to May 2021 due to the coronavirus lockdown disruption.,So far, incumbent Sadiq Khan is being challenged by Conservative Party candidate Shaun Bailey in the race. The Lib Dem choice has proved difficult as the party’s previous choice, Siobhan Benita, withdrew from the race saying she could not commit to an extra year of unpaid campaigning. The party is now back to seeking a prospective candidate after Sidhu Robb’s suspension.,“Geeta Sidhu Robb has been suspended from the Liberal Democrats and will not be on the ballot paper to be the Liberal Democrat candidate for mayor of London. There is an investigation under way in accordance with due process,” a Lib Dem spokesperson said. — PTI","Sep 14, 2020
                            ,07:36 PM (IST),11 days ago                            ",Indian-origin London mayor candidate dropped over antisemitism remarks
"The Indian Consulate in Dubai has urged employers and families of deceased Indians here to claim the mortal remains at the earliest, in view of increasing burden on the mortuaries across the Gulf kingdom, according to media reports on Monday.,“It has come to the notice of the Consulate that in some cases, the deaths of Indian nationals in Dubai and Northern Emirates are not reported to the Consulate on time, due to which there has been delays in claiming the mortal remains from various mortuaries,” the Gulf News quoted a press statement issued by the mission. ,“It is reiterated that the mortal remains must be claimed expeditiously and their burial/cremation or repatriation completed at the earliest,” the statement added.,The Consulate told the newspaper that on a couple of occasions the deceased Indians were buried in the UAE without the knowledge of their families as there was no one to claim the bodies.,In June this year, the mission had also appealed to the Indian community to report deaths of Indian nationals immediately to avoid delays.,Delays in completing formalities by the employers or families caused additional burden on the mortuaries, the mission said. The situation has been exacerbated by the COVID-19 outbreak.,The consulate said employers and sponsors should report the death of an Indian on its emergency helpline or on deathregistration.dubai@mea.gov.in         ,The COVID-19 has claimed 399 lives with nearly 80,000 confirmed infections in the UAE so far. PTI","Sep 14, 2020
                            ,07:09 PM (IST),11 days ago                            ",Indian mission decries delay in claiming of remains of deceased Indians in UAE
"An Indian-origin entrepreneur-activist was on Monday dropped as a prospective London mayoral candidate to contest against Sadiq Khan next year after her past antisemitic comments came to light.,Geeta Sidhu Robb, the founder of organic food and juice products firm Nosh Detox, had been shortlisted as the Liberal Democrat candidate to take on Labour's Khan but was instead suspended from the party after a 1997 General Election footage revealed her making anti-Jewish remarks. “I apologise profusely for my actions in the 1997 General Election campaign,” said Sidhu Robb. — PTI","Sep 15, 2020
                            ,07:09 AM (IST),10 days ago                            ",Geeta removed from UK mayor candidate list
